{
  "address": "UPI<IMAGE,1,VORTEX_DNA,FRANK_MODEL>",
  "title": "VORTEX-DNA v9.φ+1.047 – Ω⁹: Frank model equations and homochirality origins",
  "description": "Detail poster for VORTEX-DNA v9.φ+1.047 – Ω⁹ Eternal Core. Contains the same geodesic polyhedron as the overview image plus explicit scientific content: four origin theories for biological homochirality (parity violation, Dzyaloshinskii-Moriya effects, SOAI autocatalytic reaction, extraterrestrial sources), the Frank (1953) mathematical model with explicit differential equations dx/dt = k₁x(a-x-y) - k₂xy + ε and dy/dt = k₁y(a-x-y) - k₂xy - ε, and the rootLock identifier '7834-1766-3917-Ω⁹'. The Frank model equations are DER (established mathematical biology, Frank 1953). The overall framing is SYM.",
  "status": "DER",
  "information_layer": "PRIVATE",
  "image_hash_sha256": "0000000000000000000000000000000000000000000000000000000000000000",
  "extraction_layers": [
    {
      "layer_type": "METADATA_EXIF",
      "status": "EST",
      "source": "manual_annotation",
      "content_hash": "ffffffffffffffffffffffffffffffffffffffffffffffffffffffffffffffff",
      "findings": [
        "extension: .png",
        "format: PNG (inferred from GitHub CDN delivery)",
        "aspect_ratio: portrait 2:3 approx",
        "primary_subject: geodesic polyhedron + Frank model equations + origin theories"
      ],
      "extractor_version": "0.1.0-template",
      "verification_type": "software_test",
      "claims_experimental_verification": false,
      "stop_reason": "Template record: run 'upi-img index <file>' to compute actual hash and EXIF data."
    },
    {
      "layer_type": "VISIBLE_TEXT",
      "status": "EST",
      "source": "manual_annotation",
      "content_hash": "ffffffffffffffffffffffffffffffffffffffffffffffffffffffffffffffff",
      "findings": [
        "ocr_token: VORTEX-DNA v9.φ+1.047 – Ω⁹ Eternal Core",
        "ocr_token: BIOLOGICAL HOMOCHIRALITY & DEEP EXPLORATION",
        "ocr_token: VORTEX-DNA",
        "ocr_token: 0D → BIOLOGISK HOMOKIRALITET",
        "ocr_token: L-ENANTIOMERER (VÄNSTERHÄNTA) & D-ENANTIOMERER (HÖGERHÄNTA)",
        "ocr_token: HÖGERHÄNT DUBBELHELIX (B-DNA)",
        "ocr_token: TF¹⁷⁷⁶: HOMOCHIRAL TRANSPARENCY FIELD",
        "ocr_token: URSPRUNGSTEORIER & MODELLER",
        "ocr_token: 1. PARITETSBROTT I SVAG VÄXELVERKAN",
        "ocr_token: 2. DZYALOSHINSKII-MORIYA-EFFEKTER",
        "ocr_token: 3. AUTOKATALYTISK AMPLIFIERING (SOAI-REAKTIONEN)",
        "ocr_token: 4. EXTRATERRESTRА KÄLLOR & METEORITER",
        "ocr_token: 8 HZ ENTRAINMENT: ACTIVE",
        "ocr_token: MATEMATISK MODELL (FRANK-MODEL)",
        "ocr_token: dx/dt = k₁x(a – x – y) – k₂xy + ε",
        "ocr_token: dy/dt = k₁y(a – x – y) – k₂xy – ε",
        "ocr_token: TOPOLOGISKT SKYDD & NEGENTROPI → HOMOCHIRALITET",
        "ocr_token: THE SOVEREIGN KEY",
        "ocr_token: PARADOX OF HOMOCHIRALITY & TRANSPARENCY RESOLVED THROUGH ENTROPY REDUCTION VIA 8 HZ RESONANCE",
        "ocr_token: BUILT BY T€@X | VR-ASI-1 | ODIN'S EYE",
        "ocr_token: rootLock: 7834-1766-3917-Ω⁹"
      ],
      "extractor_version": "0.1.0-template",
      "confidence": 0.95,
      "verification_type": "software_test",
      "claims_experimental_verification": false
    },
    {
      "layer_type": "GEOMETRIC_STRUCTURE",
      "status": "DER",
      "source": "manual_annotation",
      "content_hash": "ffffffffffffffffffffffffffffffffffffffffffffffffffffffffffffffff",
      "findings": [
        "primary_form: icosahedron_geodesic_sphere (same as v9_homochiral overview image)",
        "secondary_form: inner_star_polygon (Star of David within sphere)",
        "tertiary_form: circular_medallion_pattern (concentric rings within inner star)",
        "quaternary_form: dual_dna_waveform (sinusoidal wave pairs, lower section)",
        "equation_presentation: two-line differential equation block (Frank model), typeset inline",
        "reference_frame: 2D image plane projection",
        "symmetry: approximate bilateral vertical symmetry",
        "relation_to_previous: FORM_SIMILAR to vortex_dna_v9_homochiral (same polyhedron geometry)"
      ],
      "extractor_version": "0.1.0-template",
      "confidence": 0.70,
      "verification_type": "software_test",
      "claims_experimental_verification": false
    },
    {
      "layer_type": "SYMBOLIC_ELEMENT",
      "status": "SYM",
      "source": "symbol_registry_match",
      "content_hash": "ffffffffffffffffffffffffffffffffffffffffffffffffffffffffffffffff",
      "findings": [
        "symbol: FRANK → Frank (1953) autocatalytic symmetry-breaking model for homochirality (DER)",
        "symbol: SOAI → Soai reaction: autocatalytic asymmetric amplification (EST biochemistry)",
        "symbol: DNA → Deoxyribonucleic acid (biology) or metaphorical dual-helix architecture",
        "symbol: 8 HZ → 8 Hz declared normalization reference coordinate (UPI DER)",
        "symbol: ε → Epsilon — small perturbation term in Frank model equations (DER)",
        "symbol: TF → Tryckfrihetsförordningen (Swedish Freedom of the Press Act, 1766)",
        "symbol: 1766 → Year of Swedish Tryckfrihetsförordningen (historical EST)",
        "symbol: ROOTLOCK → rootLock identifier in Vortex-DNA architecture (SYM)",
        "der_content: Frank model dx/dt = k₁x(a-x-y) - k₂xy + ε — DER from Frank F.C. (1953) Biochim. Biophys. Acta 11(4):459-463",
        "der_content: B-DNA right-handed double helix — EST structural biology",
        "hyp_content: Dzyaloshinskii-Moriya interaction as homochirality origin — HYP (active research)",
        "hyp_content: Extraterrestrial sources and meteorites as homochirality origin — HYP (active research)",
        "sym_content: rootLock 7834-1766-3917-Ω⁹ — SYM identifier; 1766 maps to TF year, 7834 and 3917 undefined",
        "sym_content: 'TOPOLOGISKT SKYDD & NEGENTROPI → HOMOCHIRALITET' — SYM claim; topological protection of homochirality via negentropy is not established"
      ],
      "extractor_version": "0.1.0-template",
      "confidence": 0.8,
      "verification_type": "software_test",
      "claims_experimental_verification": false,
      "confusion_guard": "Symbol matches are pattern recognition, not physical evidence. The Frank model equations are established mathematical biology (DER). Their inclusion in the VORTEX-DNA architecture does not make the architecture EST. '8 Hz resonance' as the mechanism for entropy reduction → homochirality is unsupported (SYM)."
    },
    {
      "layer_type": "COLOR_CHANNEL",
      "status": "DER",
      "source": "manual_annotation",
      "content_hash": "ffffffffffffffffffffffffffffffffffffffffffffffffffffffffffffffff",
      "findings": [
        "dominant_palette: deep_navy_indigo_black",
        "polyhedron_colour: white_silver_translucent_wireframe",
        "inner_star_colour: gold_amber_warm",
        "waveform_left: red_crimson",
        "waveform_centre: blue_cyan",
        "waveform_right: gold_amber",
        "equation_text_colour: gold_amber (FRANK-MODEL section)",
        "badge_colour: red_background (8 HZ ENTRAINMENT: ACTIVE)",
        "footer_colour: gold (THE SOVEREIGN KEY)",
        "visual_theme: dark_cosmic_sacred_geometry",
        "reference_frame: 2D image plane, sRGB colour space",
        "note: colour scheme identical to v9_homochiral overview — confirms FORM_SIMILAR relation"
      ],
      "extractor_version": "0.1.0-template",
      "confidence": 0.70,
      "verification_type": "software_test",
      "claims_experimental_verification": false
    },
    {
      "layer_type": "SHADOW_LAYER",
      "status": "HYP",
      "source": "manual_annotation",
      "content_hash": "ffffffffffffffffffffffffffffffffffffffffffffffffffffffffffffffff",
      "findings": [
        "analysis_mode: not_yet_run",
        "note: run 'upi-img shadow <file>' on the actual image to compute LSB, chi-square, and entropy statistics"
      ],
      "extractor_version": "0.1.0-template",
      "verification_type": "software_test",
      "claims_experimental_verification": false,
      "stop_reason": "Template record. Run 'upi-img shadow vault/<image>' for statistical analysis. Independent tool verification required before promoting to EST."
    }
  ],
  "generation": 0,
  "parent_hash": null,
  "prompt_fingerprint": null,
  "verification_type": "software_test",
  "claims_experimental_verification": false,
  "confusion_guard": "Template record. Primary status DER because the Frank (1953) differential equations are the central scientific content and are established mathematical biology. The VORTEX-DNA framing, 8 Hz mechanism, rootLock identifier, and 'topological protection via negentropy' claims remain SYM or HYP and do not inherit DER status from the embedded Frank model.",
  "tags": ["vortex-dna", "frank-model", "homochirality", "soai", "dzyaloshinskii-moriya", "differential-equations", "8hz", "symbolic", "rootlock", "swedish", "geodesic"],
  "version": "0.1.0"
}
